[133; 'Fels der Dämonen'; 'Ein toller Sandstrand in einer einsamen Bucht; perfektes Surf-Wetter; ein schattiges Plätzchen für das Zelt: Die drei ??? freuen sich auf ein paar stressfreie Ferientage am Meer. Doch dann taucht ein völlig verängstigter Junge auf und berichtet von einem gruseligen schwarzen Zwerg; der ihn verfolgt. Als der Zweite Detektiv kurze Zeit darauf beim Wellenreiten eine mehr als unheimliche Begegnung im Wasser hat; ist klar: hier bahnt sich ein neuer Fall für die drei Detektive an! Wer oder was treibt sein Unwesen in der abgelegenen Bucht? Werden Justus; Peter und Bob das Geheimnis um den "Fels der Dämonen" lüften?'; 'Die drei ???; Folge 133\nFels der Dämonen'; 'Veröffentlichungsdatum: 02.10.2009'; 'Erzähler - Thomas Fritsch\nJustus Jonas; Erster Detektiv - Oliver Rohrbeck\nPeter Shaw; Zweiter Detektiv - Jens Wawrczeck\nBob Andrews; Recherchen und Archiv - Andreas Fröhlich\nSergeant Ludlow - Dietmar Mues\nBanden-Chef - Eberhard Haar\nEddy Reardon - Lukas Sperber\nSpanier - Erik Schäffler\nJack - Fabian Harloff\nItaliener - Lutz Harder\nGauner - Sven Dahlem\nGehilfe - Gerhart Hinze\nPolizist - Bertram Hiese']
[134; 'Der tote Mönch'; 'Ein böser Geist will Christine Harkinson von ihrem Anwesen vertreiben! Davon ist zumindest ihr Gärtner überzeugt. Lo Wang bangt um das Leben seiner Arbeitgeberin. Justus; Peter und Bob; die drei erfolgreichen Detektive aus Rocky Beach; machen sich auf die Suche nach dem ominösen Geist. Wer oder was steckt hinter der gruseligen Kapuzengestalt; die nachts ihr Unwesen im Garten treibt? Als die drei ??? ein offenes altes Grab entdecken; ist sich Peter ganz sicher: Ein toter Mönch verfolgt Christine! Doch worauf hat er es abgesehen...?'; 'Die drei ???; Folge 134\nDer tote Mönch'; 'Veröffentlichungsdatum: 02.10.2009'; 'Erzähler - Thomas Fritsch\nJustus Jonas - Oliver Rohrbeck\nPeter Shaw - Jens Wawrczeck\nBob Andrews - Andreas Fröhlich\nChristine - Inken Sommer\nMr. Bambridge - Gustav-Adolph Artz\nLo Wang - Dae Joon Yoo\nInspektor Cotta - Holger Mahlich\nAnthony Hearst - Wolfgang Pampel\nTruck-Fahrer - Konstantin Graudus\nAvercromby - Nicolas König']
[135; 'Fluch des Piraten'; 'Eine Reihe rätselhafter Fotos weckt die Neugier der drei erfolgreichen Detektive aus Rocky Beach. Alles deutet darauf hin; dass ein kostbarer Goldschatz auf einer einsamen Insel verborgen ist. Doch vor Ort wird schnell klar; dass nicht nur Justus; Peter und Bob dem Schatz auf der Spur sind. Es beginnt eine Jagd mit ungewissem Ausgang.'; 'Die drei ???; Folge 135\nFluch des Piraten'; 'Veröffentlichungsdatum: 27.11.2009'; 'Erzähler - Thomas Fritsch\nJustus Jonas; Erster Detektiv - Oliver Rohrbeck\nPeter Shaw; Zweiter Detektiv - Jens Wawrczeck\nBob Andrews; Recherchen und Archiv - Andreas Fröhlich\nPilot - Gerhart Hinze\nMax - Traudel Sperber\nLiolotta - Peter Striebeck\nAlthena - Steffi Kirchberger\nSarah Livingston - Rosemarie Wohlbauer\nElvira Zuckerman - Konstanze Ullmer']
[136; 'und das versunkene Dorf'; 'In einem kleinen Bergdorf scheint ein Geist sein Unwesen am nahe gelegenen See zu treiben! Welches dunkle Geheimnis verbirgt sich in den Tiefen des Gewässers? Wer oder was steckt hinter der gespenstischen Erscheinung am Ufer? Die drei ??? gehen auf Tauchstation; um das Geheimnis zu lüften. Und dann entdecken sie das Unvorstellbare...'; 'Die drei ???; Folge 136\nund das versunkene Dorf'; 'Veröffentlichungsdatum: 05.02.2010'; 'Erzähler - Thomas Fritsch\nJustus Jonas - Oliver Rohrbeck\nPeter Shaw - Jens Wawrczeck\nBob Andrews - Andreas Fröhlich\nDarren Duff - Jesse Grimm\nTaucher Carl - Oliver Böttcher\nTaucherin Joan - Christine Pappert\nPaul Brooks - Heinz Lieven\nJoe Wilcox - Rolf Becker\nCassandra Wilcox - Elke Reissert\nDaniel - Jochen Baumert\nHenry - Frank Felicetti\nDoktor Holloway - Barbara Focke\nCedric Duff - Rolf E. Schenker']
[137; 'Pfad der Angst'; 'Ein neuer Fall bahnt sich an; ganz nach dem Geschmack der drei erfolgreichen Detektive aus Rocky Beach: Ein verschrobener Wissenschaftler bittet die drei ??? um Hilfe bei der Wiederbeschaffung einer Erfindung; die ihm gestohlen wurde. Doch dann häufen sich merkwürdige Geschehnisse und behindern die Recherchen. Natürlich lassen sich Justus; Peter und Bob zunächst nicht beeindrucken - bis sie um ihr Leben bangen müssen...'; 'Die drei ???; Folge 137\nPfad der Angst'; 'Veröffentlichungsdatum: 12.03.2010'; 'Erzähler - Thomas Fritsch\nJustus Jonas - Oliver Rohrbeck\nPeter Shaw - Jens Wawrczeck\nBob Andrews - Andreas Fröhlich\nWinston Granville - Christian Rode\nMatthew Granville - Uwe Friedrichsen\nSmithy - Konstantin Graudus\nMr. Jackmore - Michael Brennicke\nProfessor Frazier - Wilhelm Wieben\nPolizist - Tetje Mierendorf']
[138; 'Die geheime Treppe'; 'Warum wurde der junge Wissenschaftler Davy Swann entführt? Und warum nannten ihn die vermummten Täter immer Philippe? Justus; Peter und Bob nehmen die Spur auf. Diese führt in das labyrinthische Gebäude der Universität mit geheimen Treppen und einer düsteren Bibliothek. Hier stoßen die drei ??? auf ein merkwürdiges Buch und seltsame Verse. Natürlich knacken die drei erfolgreichen Detektive aus Rocky Beach das Rätsel. Doch dann fangen die Schwierigkeiten erst an...'; 'Die drei ???; Folge 138\nDie geheime Treppe'; 'Veröffentlichungsdatum: 21.05.2010'; 'Erzähler - Thomas Fritsch\nJustus Jonas - Oliver Rohrbeck\nPeter Shaw - Jens Wawrczeck\nBob Andrews - Andreas Fröhlich\nDavy Swann - Thorsten Sense\nInspektor Cotta - Holger Mahlich\nCraig Holden - Gerhard Olschewski\nLöwenritter - Burghart Klaußner']
[139; 'Das Geheimnis der Diva'; 'Seltsame Vorkommnisse überschatten die Proben der Laienspielgruppe "Die Masken" im alten Stadttheater von Rocky Beach: Kulissen verschwinden und eine Schauspielerin wird hinter der Bühne von einem grässlichen Phantom angegriffen. Wer oder was treibt sein Unwesen in dem verwinkelten Theatergebäude? Hängen die Ereignisse mit der international bekannten Schauspielerin Helena Darraz zusammen; die in wenigen Tagen nach Rocky Beach kommen will? Sofort nehmen die drei ??? die Ermittlungen auf. Und es wird gefährlich...'; 'Die drei ???; Folge 139\nDas Geheimnis der Diva'; 'Veröffentlichungsdatum: 09.07.2010'; 'Erzähler - Thomas Fritsch\nJustus Jonas - Oliver Rohrbeck\nPeter Shaw - Jens Wawrczeck\nBob Andrews - Andreas Fröhlich\nTitus Jonas - Hans Meinhardt\nInspektor Cotta - Holger Mahlich\nHelena Darraz - Ingrid Andree\nMorton - Andreas von der Meden\nPritchard - Sascha Rotermund\nSid - Tilman Madaus\nCaroline - Celine Fontanges\nSandy - Simona Pahl\nSteven - René Dawn-Claude\nErnest - Tim Kreuer\nRadioansagerin - Susanne Wulkow\nHarvey Griscom - Christian Rudolf\nJohn Dellcourt - Gustav Adolph Artz\nMiss Darraz - Sabine Hahn']
[140; 'Stadt der Vampire'; 'Eine riesige Fledermaus versetzt die Kleinstadt Yonderwood in Angst und Schrecken. Nachdem einige Menschen mit Bissspuren und einer Menge Blut in ihren Betten erwacht sind; hat der Großteil der Einwohner bereits das Weite gesucht. Justus; Peter und Bob haben noch nie an Vampire geglaubt. In diesem neuen Fall jedoch scheint es; als müssten die drei berühmten Detektive aus Rocky Beach ihre Meinung ändern...'; 'Die drei ???; Folge 140\nStadt der Vampire'; 'Veröffentlichungsdatum: 20.08.2010'; 'Erzähler - Thomas Fritsch\nJustus Jonas - Oliver Rohrbeck\nPeter Shaw - Jens Wawrczeck\nBob Andrews - Andreas Fröhlich\nJosy McDonaghough - Lili Draeger\nHomer Diesel - Christian Senger\nMary Stamper - Annabelle Krieg\nOtis Stamper - Klaus Dittman\nJonathan Black - Eckart Dux\nMiles Black - Sascha Rotermund\nKlara Kowalski - Steffi Kirchberger\nSilvester Proud - Gustav A. Artz\nPfarrer Clark - Gerd Baltus']
[141; 'und die Fußball-Falle'; 'Der Fußballstar Jeffrey Seaman und seine Mannschaft bereiten sich in Rocky Beach auf ein Mehrländerturnier vor. Doch merkwürdige Zwischenfälle stören das Training und versetzen die Spieler in Angst und Schrecken. Als auch noch der ägyptische Totengott Anubis in den Katakomben unter dem Fußballstadion auftaucht und sein Unwesen treibt; ist klar: Die drei ??? müssen all ihren detektivischen Spürsinn aufbieten; um diesen Fall zu lösen!'; 'Die drei ???; Folge 141\nund die Fußball-Falle'; 'Veröffentlichungsdatum: 01.10.2010'; "Erzähler - Thomas Fritsch\nJustus Jonas - Oliver Rohrbeck\nPeter Shaw - Jens Wawrczeck\nBob Andrews - Andreas Fröhlich\nOnkel Titus Jonas - Hans Meinhardt\nInspektor Cotta - Holger Mahlich\nJeffrey Seaman - Daniel Welbat\nSteven - Oliver Böttcher\nEric - Patrick Bach\nMr. Settler - Christian Senger\nAuktionator - Achim Schülke\nFrau - Hilla Fitzen\nPatrick O'Brian - Wolfgang Riehm\nWilliam de Haas - Jörg Gillner\nTheodor Brewster - Tobias Meister\nButler - Olaf Kreuzenbeck"]
[142; 'Tödliches Eis'; 'Schnee und Eis; Wölfe und arktische Stürme - das Nordic Wilderness Race ist eines der härtesten Schlittenhunderennen der Welt. Als die drei ??? von der Journalistin Carol Ford gefragt werden; ob sie bei der Reportage über das Rennen helfen wollen; sagen die Jungen begeistert zu. Doch damit lassen sie sich auf ein gefährliches Abenteuer ein. Als es zu einem ernsthaften Zwischenfall mit skrupellosen Verbrechern kommt; ist klar: Die drei Detektive müssen schnell handeln; damit dies nicht ihr letzter Fall wird!'; 'Die drei ???; Folge 142\nTödliches Eis'; 'Veröffentlichungsdatum: 03.12.2010'; 'Erzähler - Thomas Fritsch\nJustus Jonas - Oliver Rohrbeck\nPeter Shaw - Jens Wawrczeck\nBob Andrews - Andreas Fröhlich\nCarol Ford - Claudia Schermutzki\nFrancis Studstill - Elena Wilms\nBaxter Norsworthy - Udo Schenk\nGordon Hoke - Holger Löwenberg\nJared Fox - Meik Spallek\nCandace Duskin - Andrea Linau\nGeorge Bennet - Urs Affolter\nGreg Harper - Robert Missler\nWoodland - Jürgen Thormann\nReporterin - Jamie Leaves\nReporter - Glenn Goltz\nWellford - Oliver Geilhardt\nPilot - Achim Schülke\nLautsprecherstimme - Sascha Draeger']
[143; 'und die Poker-Hölle'; 'Als Justus; Peter und Bob einem jungen Mann helfen wollen; dem in einer Postfiliale Geld gestohlen wurde; geraten sie in die gefährliche Unterwelt von China Town. Zufällig kommen sie einer illegalen Pokerspielhölle auf die Spur. Dabei müssen die drei erfolgreichen Detektive aus Rocky Beach die Erfahrung machen; dass die Beteiligten sehr unangenehm werden; wenn man ihnen in die Karten sieht! Und dann geschieht; was nie hätte geschehen dürfen...'; 'Die drei ???; Folge 143\nund die Poker Hölle'; 'Veröffentlichungsdatum: 03.12.2010'; 'Erzähler - Thomas Fritsch\nJustus Jonas - Oliver Rohrbeck\nPeter Shaw - Jens Wawrczeck\nBob Andrews - Andreas Fröhlich\nRichie Hanson - Dennis Schmidt-Foß\nInspektor Cotta - Holger Mahlich\nGoodween - André Minninger\nBenni - Ivo Möller\nJacki Jin - Robert Missler\nKellnerin - Corinna Wodrich\nCroupier - Dirk Bach\nMann - Arndt Schmöle']
[144; 'Zwillinge der Finsternis'; 'Es schneit bei 20 Grad über Null; ein riesiger Erdspalt tut sich über Nacht auf; seltsame Nebel wabern; und ein Mann lässt Flammen aus seiner Hand wachsen: Rocky Beach hat es mit dem Teufel zu tun! Das jedenfalls nimmt Peter an; als er und seine beiden Detektivkollegen in den Fall "Zwillinge der Finsternis" geraten. Zwei in Leder gebundene Bücher sollen satanische Zauberformeln enthalten. Wer sie besitzt; hat teuflische Macht. Und es gibt einige Menschen; die hinter den beiden Büchern her sind. Ein Exemplar wurde bereits gestohlen! Die drei ??? müssen ihren Widersachern schnellstens zuvorkommen; um das Schlimmste zu verhindern...'; 'Die drei ???; Folge 144\nZwillinge der Finsternis'; 'Veröffentlichungsdatum: 28.01.2011'; 'rzähler - Thomas Fritsch\nJustus Jonas - Oliver Rohrbeck\nPeter Shaw - Jens Wawrczeck\nBob Andrews - Andreas Fröhlich\nOnkel Titus Jonas - Hans Meinhardt\nArthur Sinclair - Joachim Pukaß\nMr. Peastone - Eberhard Haar\nJeremy Witherspoon - Martin Semmelrogge\nBarnaby Witherspoon - Achim Schülke\nInspektor Cotta - Holger Mahlich\nGodwin - André Minninger\nMann - Holger Löwenberg']
[145; 'und die Rache der Samurai'; 'Auf dem Internat "Shadow Stone" geht es nicht mit rechten Dingen zu. Ein Schüler ist spurlos verschwunden; und die Mitglieder der Samurai-AG; die mit alten japanischen Schwertern kämpfen; verhalten sich mehr als merkwürdig. Um den Fall zu klären; schleusen sich die drei ??? in die Schule ein. Doch schnell bekommen sie zu spüren; dass sie hier unerwünscht sind. Besonders Peter muss nun all seinen Mut unter Beweis stellen: Das Schwert. Ein kurzer Schwung; der die Luft durchschnitt. Das Blut gefror in seinen Adern. Es war so weit. Der Tod. Warum bloß hatten sie diesen Auftrag angenommen? Warum bloß?!'; 'Die drei ???; Folge 145\nDie Rache der Samurai'; 'Veröffentlichungsdatum: 04.03.2011'; 'rzähler - Thomas Fritsch\nJustus Jonas - Oliver Rohrbeck\nPeter Shaw - Jens Wawcrzeck\nBob Andrews - Andreas Fröhlich\nTakasi Yukawa - Wilfried Diallaz\nFrank Hektor - Michael Lott\nSean Doherty - Leonhard Mahlich\nMandy - Jasmin Wagner\nZeno Daniels - Philipp Baltus\nPercy - Jesse Grimm\nKeko - Jens Wendland\nAnthony Fender - Peter Buchholz']
[146; 'Der Biss der Bestie'; 'Zugegeben das Säbelzahntigerskelett mit den riesigen Fangzähnen im Naturkundemuseum von Rocky Beach sieht sehr bedrohlich aus. Aber dass es nachts durch die Gegend spukt; kann Justus nun wirklich nicht glauben! Wer oder was treibt dann sein Unwesen im "Geistermuseum"; wie der Ort von den Nachbarn schon genannt wird? Die drei ??? gehen den Spuren nach. Und entdecken das Unfassbare...'; 'Die drei ???; Folge 146\nDer Biss der Bestie'; 'Veröffentlichungsdatum: 06.05.2011'; 'Erzähler - Thomas Fritsch\nJustus Jonas - Oliver Rohrbeck\nPeter Shaw - Jens Wawrczeck\nBob Andrews - Andreas Fröhlich\nOnkel Titus - Hans Meinhardt\nTante Mathilda - Karin Lieneweg\nInspektor Cotta - Holger Mahlich\nQuentin Wadleigh - Christian Rudolf\nDr. Winston Wadleigh - Mathias Münster\nDr. John Frears - Wolfgang Draeger\nJamie - Philipp Draeger\nSammy - Jacob Mayerhoff\nMrs. Pitkätossu - Ingeborg Kallweit\nJackall Madson - Ingo Nommsen\nTiger Madson - Dieter Dücker\nVivian - Saskia Mayerhoff\nFitzwilliam Waterfield - Wolfgang Völz\nSanitäter - Robin Brosch']
[147; 'Grusel auf Campbell Castle'; 'Adam Campbell hat ein schweres Erbe angetreten: er muss das imposante Schloss seines verstorbenen Vaters in Schuss halten. Bei einer spiritistischen Sitzung meldet sich dessen Geist und spricht von einem sonderbaren Vermächtnis. Natürlich nehmen die drei ??? die Ermittlungen auf. Mit einem Gespenst; davon sind sie überzeugt; haben sie es nicht zu tun! Bis Peter von einer gruseligen schwarzen Hand ins Meer gezogen wird. Erst in letzter Sekunde kann er gerettet werden. Der Zweite Detektiv ahnt Unheilvolles: Wurde er von einem Wassergeist attackiert?'; 'Die drei ???; Folge 147\nGrusel auf Campbell Castle'; 'Veröffentlichungsdatum: 24.06.2011'; 'Erzähler - Thomas Fritsch\nJustus Jonas - Oliver Rohrbeck\nPeter Shaw - Jens Wawrczeck\nBob Andrews - Andreas Fröhlich\nAdam Campbell - Santiago Ziesmer\nHenry Campbell - Christian Rudolf\nJohn Taylor - Holger Umbreit\nEdward Crockett - Ben Hecker\nMrs. Harkort - Katja Brügger\nMr. Prescott - Stefan Kaminski\nSkinny Norris - Andreas von der Meden\nJack Leech - Volker Bogdan\nInspektor Cotta - Holger Mahlich\nGodween - André Minninger\nEinbrecher - Patrick Bach\nMax - Tommaso Cacciapuoti']
[148; 'und die feurige Flut'; 'Ein schwerer Fluch lastet auf Allie Jamison; einer alten Bekannten der drei ???. Jedenfalls ist sie davon überzeugt. Schon in der nächsten Vollmondnacht soll etwas Schlimmes geschehen! Es gibt nur einen Ausweg: Justus; Peter und Bob müssen ein alchemistisches Rätsel lösen - in nur 24 Stunden. Ihre fieberhaften Ermittlungen führen die drei Detektive in eine Welt von Zauberern und Wahrsagern. Als Justus jedoch in einen Hinterhalt gelockt wird; ist klar: Dieser Fall ist lebensgefährlich!'; 'Die drei ???; Folge 148\nund die feurige Flut'; 'Veröffentlichungsdatum: 19.08.2011'; 'ERZÄHLER - Thomas Fritsch\nJustus Jonas - Oliver Rohrbeck\nPeter Shaw - Jens Wawrczeck\nBob Andrews - Andreas Fröhlich\nAllie Jamison - Katrin Fröhlich\nInspektor Cotta - Holger Mahlich\nUrsula Burns - Birke Bruck\nEmerald Pendragon - Monty Arnold\nCarl Parsley - Peter Weis\nSunshine - Dagmar Dreke\n1. Mann - Tetje Mierendorf\n2. Mann - Gosta Liptow']
[149; 'Der namenlose Gegner'; 'In dem sonst so idyllischen Vorort Seven Pines droht ein Nachbarschaftskrieg auszuarten. Die aufgebrachten Anwohner bitten die drei ??? um Hilfe. Doch Bob wird bei einer nächtlichen Beschattungsaktion verletzt und verliert das Bewusstsein. Als er wieder zu sich kommt; weiß er nicht mehr; wer er ist! Das nutzt ein alter Feind der drei ??? gnadenlos aus. Während der dritte Detektiv nun auf unerwartete Abwege gerät; bekommen Justus und Peter es mit einem gefährlichen Gegner zu tun. Schnell wird aus einem scheinbar harmlosen Routinefall eine harte Probe für das berühmte Trio aus Rocky Beach - womöglich die härteste; die es für sie gegeben hat...'; 'Die drei ???; Folge 149\nDer namenlose Gegner'; 'Veröffentlichungsdatum: 30.09.2011'; 'Erzähler - Thomas Fritsch\nJustus Jonas - Oliver Rohrbeck\nPeter Shaw - Jens Wawrczeck\nBob Andrews - Andreas Fröhlich\nCynthia McGowan - Luise Lunow\nInspektor Cotta - Holger Mahlich\nMr. Andrews - Henry König\nMrs. Andrews - Konstanze Ullmer\nSkinny Norris - Andreas von der Meden\nMina Parker - Annabelle Krieg\nBrandon Fraser - Tim Grobe\nBeatrix Fraser - Sophie Lechtenbrink\nRoxy - Julia Fölster\nJosh - Volker Hanisch\nPaul - Tim Kreuer\nDavis - Frank Meyer-Brockmann']
[150; 'Geisterbucht'; 'Die drei ??? übernehmen und lösen (hoffentlich!) ihren 150sten Fall! In drei atemberaubenden Folgen sind sie dem Rätsel der Geisterbucht auf der Spur! Welches Geheimnis verbirgt sich hinter dem Testament; dass der exzentrische Harry Shreber kurz vor seinem Tod verfasst hat? Führen die verschlüsselten Verse tatsächlich zu Rashuras Schatz? (Teil A) Den drei Detektiven wird nichts anderes übrig bleiben: Sie müssen in Flammendes Wasser (Teil B) hinab tauchen; denn nur in der Tiefe des Meeres kann geklärt werden; warum Der brennende Kristall (Teil C) so viel Unglück über eine große Anzahl Menschen bringen konnte... Teil A: Rashuras Schatz Die drei berühmten Detektive aus Rocky Beach müssen ein Rätsel lösen; das ihnen der schrullige Harry Shreber in seinem Testament hinterlassen hat. Schnell finden sie heraus; dass der erste Hinweis in einem schrottreifen Flugzeug in Shrebers Garten versteckt sein könnte. Die Suche nach Rashuras Schatz beginnt - aber Justus; Peter und Bob sind bei weitem nicht die Einzigen; die das Rätsel lösen wollen... Teil B: Flammendes Wasser Die Spur zu Rashuras Schatz führt die drei ??? hoch in die Berge; tief unter die Erde und hinaus auf die offene See. Aber mit jedem Hinweis wird alles nur noch geheimnisvoller ? und gefährlicher! Ein Wettlauf mit der Zeit beginnt... Teil C: Der brennende Kristall Noch immer haben Justus; Peter und Bob das Rätsel aus dem Testament nicht lösen können. Welche Rolle spielen Moby Dick und der brennende Kristall? Die drei ??? begeben sich zur Geisterbucht; um das Geheimnis zu lüften. Doch sie sind nicht allein! Jeder pokert hoch in diesem Spiel; das nur einer gewinnen kann...'; 'Die drei ???; Folge 150\nGeisterbucht'; 'Veröffentlichungsdatum: 11.11.2011'; "Teil A\nErzähler - Thomas Fritsch\nJustus Jonas - Oliver Rohrbeck\nPeter Shaw - Jens Wawrczeck\nBob Andrews - Andreas Fröhlich\nFrank Mason - Wolfgang Condrus\nMiles Dempster - Stephan Benson\nMr. Sapchevsky - Andreas Schmidt-Schaller\nGerry - Kostja Ullmann\nIsmael - Stephan Schad\nCarla Fenton - Natalie O'Hara\nMrs. Maruthers - Ulrike Johannson\nInspektor Havilland - Oliver Kalkofe\nTaylor - Bernhard Hoecker\nInspektor Cotta - Holger Mahlich\nAngelica - Anna Thalbach\nSchwester 1 - Manuela Becker\nSchwester 2 - Traudel Sperber\nPfleger - Sven Dahlem\nTeil B\nErzähler - Thomas Fritsch\nJustus Jonas - Oliver Rohrbeck\nPeter Shaw - Jens Wawrczeck\nBob Andrews - Andreas Fröhlich\nMorton - Andreas von der Meden\nTaylor - Bernhard Hoecker\nMr. Smith - Tim Grobe\nCurtis Fisher - Tobias Schmidt\nAmrita Chakyar - Angela Stresemann\nInspektor Havilland - Oliver Kalkofe\nIsmael - Stephan Schad\nAngelica - Anna Thalbach\nSergeant Madhu - Olli Dittrich\nMr. Andrews - Henry König\nMrs. Andrews - Konstanze Ullmer\nFrank Mason - Wolfgang Condrus\nMr. Raffer - Harald Dietl\nFeuerwehrmann - Kai-Hendrik Möller\nKapitän - Sky du Mont\nTeil C\nErzähler - Thomas Fritsch\nJustus Jonas - Oliver Rohrbeck\nPeter Shaw - Jens Wawrczeck\nBob Andrews - Andreas Fröhlich\nMorton - Andreas von der Meden\nFrank Mason - Wolfgang Condrus\nTaylor - Bernhard Hoecker\nCurtis Fisher - Tobias Schmidt\nJohn Fisher - Dirk Bach\nGerry - Kostja Ullmann\nIsmael - Stephan Schad\nMr. Smith - Tim Grobe\nMrs. Maruthers - Ulrike Johannson\nAngelica - Anna Thalbach\nSergeant Madhu - Olli Dittrich\nMr. Castro - Jörg Gillner\nSanitäter - Robert Kottula\nAnudhara - Rosakutty Hemsing\nRuth - Gabriele Libbach"]
[151; 'Schwarze Sonne'; 'Bei einem Malkurs lernt Bob den sympathischen und begabten Denzel Hopkins kennen. Der Mann wird plötzlich beschuldigt; ein wertvolles Gemälde gestohlen zu haben. Denzel beteuert; das Bild noch nie gesehen zu haben und unschuldig zu sein. Wie konnte er dann bereits in der Vergangenheit immer wieder ein zentrales Motiv aus diesem Bild malen - die schwarze Sonne? Die drei ??? müssen ihren gesamten detektivischen Spürsinn aufbieten; um diesen Fall zu lösen.'; 'Die drei ???; Folge 151\nSchwarze Sonne'; 'Veröffentlichungsdatum: 20.01.2012'; 'Erzähler - Thomas Fritsch\nJustus Jonas - Oliver Rohrbeck\nPeter Shaw - Jens Wawrczeck\nBob Andrews - Andreas Fröhlich\nLaurence Seinfeld - Wolf Frass\nDenzel Hopkins - Tilo Schmitz\nGoldie Hopkins - Madeleine Weingarten\nNeil Rockwell - Wanja Mues\nInspektor Cotta - Holger Mahlich\nMrs. Summer Hopkins - Regina Lemnitz\nBrooks; Galerist - Martin May\nMr. Elroy Follister - Stephan Schwartz\nMartha - Hanna Reisch\nDillon - Gregor Reisch\nWayne - Woody Mues\nGefängniswärter - Gosta Liptow\nWirt - Klaus Dittmann\nGreis - Jürgen Thormann\nBeamter - Monty Arnold\nTaxifahrer - Harald Dietl']
[152; 'Skateboardfieber'; 'Ein riesiges Skatertreffen findet in Rocky Beach statt. In der Stadt ist die Hölle los; und das nicht nur wegen des Skating-Events: Eine Reihe zwielichtiger Gestalten treibt sich in der Gegend herum; es fallen Schüsse; und niemand weiß genau; wer auf welcher Seite steht. Ein alter Fall der drei ??? spielt auf einmal wieder eine wichtige Rolle. Und ohne die Hilfe ihrer alten und neuen Freunde könnte dies der letzte Fall für einen der drei Detektive werden...'; 'Die drei ???; Folge 152\nSkateboardfieber'; 'Veröffentlichungsdatum: 02.03.2012'; 'Erzähler - Thomas Fritsch\nJustus Jonas - Oliver Rohrbeck\nPeter Shaw - Jens Wawrczeck\nBob Andrews - Andreas Fröhlich\nInspektor Cotta - Holger Mahlich\nBert Young - Horst Stark\nMrs. Johnson - Gabriele Libbach\nChapman - Sascha Rotermund\nTony - Reent Reins\nBlake - Wolfgang Rositzka\nMr. Andrews - Henry König\nRubbish George - Utz Richter\n1.Mann - Rasmus Borowski\n2.Mann - Jo Kappl\nVerkäufer - Marcus Schönhoff\nSunny - Rainer Schmitt\nFernsehr-Sprecher - Jannik Schümann\nBlacky - Heikedine Körting\nFrancesco - Anton Sprick']

[157; 'Im Zeichen der Schlangen'; 'Auf dem Schrottplatz laufen die Vorbereitungen für eine große Auktion auf Hochtouren. Plötzlich erscheint ein bedrohlicher Riese und beauftragt die drei Detektive mit einem geheimnisvollen Fall. Die Spur führt immer tiefer in längst vergangene Zeiten. Noch ahnen Justus; Peter und Bob nicht; dass sie schon bald in einen Strudel gefährlicher Ereignisse geraten werden. Doch mysteriöse Rätsel; nächtliche Beschatter; geisterhafter Rauch und ein bewaffnetes Phantom machen den drei ??? schnell klar; dass ihr ganzes Können gefordert ist; um nicht auf der Strecke zu bleiben. Nichts ist so; wie es auf den ersten Blick scheint...'; 'Die drei ???; Folge 157\nIm Zeichen der Schlangen'; 'Veröffentlichungsdatum: 28.09.2012'; 'Erzähler - Thomas Fritsch\nJustus Jonas - Oliver Rohrbeck\nPeter Shaw - Jens Wawrczeck\nBob Andrews - Andreas Fröhlich\nOnkel Titus - Hans Meinhardt\nRiese - Tilo Schmitz\nHunnicutt - Heinz Lieven\nSheila - Melanie Pukaß\nSkinny Norris - Andreas von der Meden\nInspektor Cotta - Holger Mahlich\nFelicity - Kari Erlhoff\nChester - Mike Olsowski\nGodween - André Minninger\nGizmo - Michael von Rospatt']
[158; 'und der Feuergeist'; 'Die privat geführte Oper Califia in Rocky Beach steht vor dem finanziellen Aus. So ist es nicht verwunderlich; dass die drei ??? zunächst an eine werbewirksame Veranstaltung glauben; als sich eine Mitarbeiterin der Oper Hilfe suchend an sie wendet: Im Gewölbekeller des Gebäudes gehen mysteriöse Dinge vor sich - und ein seltsames Wesen wurde gesichtet! Justus; Peter und Bob übernehmen den Fall und ahnen nicht; auf was sie sich da einlassen. Plötzlich bricht während einer Aufführung ein Großfeuer aus! War es Brandstiftung? Welche Rolle spielen dabei der undurchsichtige Moody Firthway und sein rotes Notizbuch? Nur Justus erkennt als Einziger; was sich tatsächlich hinter den Kulissen abspielt.'; 'Die drei ???; Folge 158\nund der Feuergeist'; 'Veröffentlichungsdatum: 30.11.2012'; 'Erzähler - Thomas Fritsch\nJustus Jonas - Oliver Rohrbeck\nPeter Shaw - Jens Wawrczeck\nBob Andrews - Andreas Fröhlich\nMichelle - Ulrike Stürzbecher\nRonald Pounder - Jürgen Kluckert\nMaurice Blight - Oliver Böttcher\nBetsy - Heidi Schaffrath\nIsabella - Isabel Navarro\nVladas Abakulow - Eric Schäffler\nMoody Firthway - Peter Striebeck\nPolizist - Mike Olsowski\nJenna - Konstanze Ullmer\n1. Mann - Olaf Kreutzenbeck\n2. Mann - Rainer Fritzsche\n3. Mann - Claus Fuchs\n4. Mann - Jannik Endemann']
