[85; 'Feuerturm'; 'Wer ist Jonny? Und warum ist er verschwunden? Die drei Detektive aus Rocky Beach stehen vor einer schier unlösbaren Aufgabe. Sie sollen einen unbekannten Mann finden und ihm einen Brief übergeben; der zu einem geheimnisvollen Schatz führt. Die anonyme Botschaft lockt die drei ??? In die Wildnis des King\\\\s National Parks. Plötzlich wird der Botendienst lebensgefährlich für Justus; Peter und Bob: Jemand versucht; ihren Auftrag zu vereiteln. Werden die drei Detektive Jonny helfen können; bevor die Falle zuschnappt? Ein Wettlauf gegen die Zeit beginnt.'; 'Die drei ???; Folge 85\nFeuerturm'; 'Veröffentlichungsdatum: 10.05.1999'; 'Erzähler - Matthias Fuchs\nJustus Jonas; Erster Detektiv - Oliver Rohrbeck\nPeter Shaw; Zweiter Detektiv - Jens Wawrczeck\nBob Andrews; Recherchen und Archiv - Andreas Fröhlich\nWalker - Lothar Grützner\nMonica - Hansi Jochmann\nLady MacWeiden - Renate Pichler\nMac George - Johann Schibli\nChris - Daniel Kruth\nCampingwart - Helmut Ahner\nFrau des Campingwarts - Ingrid Weiß']
[86; 'Nacht in Angst'; 'Freitag abend; 20.25 Uhr; Steadman-Museum; Los Angeles: Mr. Peacock; der freundliche; aber schusselige Museums-Direktor; betritt mit Justus; Peter und Bob das Gebäude. In wenigen Minuten werden die drei Detektive exklusiv den wertvollsten Diamanten der Welt sehen: das berühmte Feuer des Mondes. 20.28 Uhr: Im Museum gehen die Lichter aus. Stromausfall? Sabotage? 20.30 Uhr: Fünf Gangster dringen in das Museum ein. Kurze Zeit später befinden sich Mr. Peacock und die drei ??? In ihrer Gewalt. Die Verbrecher wollen den Diamanten und sie sind breit; dafür über Leichen zu gehen.'; 'Die drei ???; Folge 86\nNacht in Angst'; 'Veröffentlichungsdatum: 09.08.1999'; 'Erzähler - Matthias Fuchs\nJustus Jonas; Erster Detektiv - Oliver Rohrbeck\nPeter Shaw; Zweiter Detektiv - Jens Wawrczeck\nBob Andrews; Recherchen und Archiv - Andreas Fröhlich\nMorton - Andreas von der Meden\nMr. Peacock; Museumsdirektor - Helmut Ahner\nAlpha - Achim Schülke\nBeth - Katja Brügger\nErnie - Wolfgang Hartmann\nDog - Niko Minninger\nCeewee - Michael Quiatkowski']
[87; 'Wolfsgesicht'; 'Der Mann lebt allein an der Küste; die Nachbarn kennen ihn kaum; das Haus verlässt er nur selten: ein einsamer Wolf - oder ist er in Wirklichkeit das Wolfsgesicht; der gefürchtete Attentäter? Zweimal hat er bereits zugeschlagen; und jedesmal konnte er fliehen; ohne Spuren zu hinterlassen. Selbst Justus; das Computerhirn der Drei ???; ist ratlos. Da erhält die Polizei Hinweise auf den nächsten Coup. Diesmal plant der Attentäter einen Anschlag auf den Präsidenten der Vereinigten Staaten. Die Zeit drängt. Schon morgen wird der Präsident nach Rocky Beach kommen.'; 'Die drei ???; Folge 87\nWolfsgesicht'; 'Veröffentlichungsdatum: 11.10.1999'; 'Erzähler - Matthias Fuchs\nJustus Jonas; Erster Detektiv - Oliver Rohrbeck\nPeter Shaw; Zweiter Detektiv - Jens Wawrczeck\nBob Andrews; Recherchen und Archiv - Andreas Fröhlich\nInspektor Cotta - Holger Mahlich\nMrs. Harding; Polizeipsychologin - Katrin Wasow\nMr. Ambler; Assistent - Rainer Schmitt\nRodder; das Wolfsgesicht - Andreas Martens\nMr. Laurent; Ladenbesitzer - Lutz Lukasz\nMr. Stepelton; Ladenbesitzer - Harald Pages\nRay; Praktikant - Marcel Rinkenauer\nSandy; Verkäuferin - Kathi Robens\nKundin - Cornelia Meinhardt']
[88; 'Vampir im Internet'; 'Mit voller Kraft rast der Vampir gegen die Scheibe. Glas splittert; Scherben fliegen durch die Luft. Das Fledermaus-Monster scheint die Wände seines Käfigs zu sprengen: Das brandneue Computerspiel zieht die drei Detektive aus Rocky Beach in seinen Bann. Begeistert tauchen sie ein in die virtuelle Welt der Drachen und Monster. Die Welt des Spiels scheint sich mit der Realität zu vermischen. Justus; Peter und Bob müssen höllisch aufpassen; um den Vampiren nicht zum Opfer zu fallen.'; 'Die drei ???; Folge 88\nVampir im Internet'; 'Veröffentlichungsdatum: 13.12.1999'; 'Erzähler - Matthias Fuchs\nJustus Jonas; Erster Detektiv - Oliver Rohrbeck\nPeter Shaw; Zweiter Detektiv - Jens Wawrczeck\nBob Andrews; Recherchen und Archiv - Andreas Fröhlich\nDoe Dungeon; Programmierer - Wolfgang Draeger\nLili Buschfort - Christina Holsten\nTom Beker - Wolfgang Hartmann\nMärchenerzähler - Hans Paetsch\nKönigin Trulie - Hanna Reisch\nVinton - Nils Noller\nAmme Katharina Brauren\nMedusa Marianne Kehlau\nOinki Hinki Niko Minninger\nVampir-Frau Julia von Spieß\nHexe Micaela Kreißler\nOma Beate Hasenau\nWache Michael Quiatkowsky\nComputerstimme Sascha Gutzeit']
[89; 'Tödliche Spur'; 'Morton ist tot! Der Freund und Chauffeur der drei Detektive aus Rocky Beach ist mit seinem Wagen über die Klippen gestürzt. - Ein Unfall? Oder war es Mord? Justus; Peter und Bob sind ratlos. Was wissen sie eigentlich über Morton? Die drei ??? beginnen in der Vergangenheit ihres Freundes zu stöbern und entdecken dabei Hinweise; die sie lieber nicht gefunden hätten. Als plötzlich ein rätselhafter Geheimcode auftaucht; wird Justus\\ Kombinationsgabe auf eine harte Probe gestellt. Es bleibt nicht viel Zeit; denn die Schatten der Vergangenheit rücken unaufhaltsam näher...'; 'Die drei ???; Folge 89\nTödliche Spur'; 'Veröffentlichungsdatum: 15.05.2000'; 'Erzähler - Matthias Fuchs\nJustus Jonas; Erster Detektiv - Oliver Rohrbeck\nPeter Shaw; Zweiter Detektiv - Jens Wawrczeck\nBob Andrews; Recherchen und Archiv - Andreas Fröhlich\nMorton - Andreas von der Meden\nInspektor Cotta - Holger Mahlich\nMr. Gilbert - Manfred Reddemann\nMrs. Grayson - Beate Hasenau\nMr. Perkins - Marco Kröger\nMac Dunno - Gerhard Marcel\nWachmann - Ulli Plessmann\n ']
[90; 'Der Feuerteufel'; 'Auf der Suche nach einer passenden Maske für eine Halloween-Party trifft Peter auf Aaron Moore. Der Grusel-Autor wird von einem dämonischen Feuerteufel bedroht und bangt um sein Leben. Bereits drei unheimliche Vorzeichen haben sich erfüllt: Feuer; Luft und Erde haben sich gegen den Schriftsteller erhoben. Erfüllt sich auch das vierte Zeichen; bedeutet dies den Tod Moores. Können Justus; Peter und Bob; die drei erfolgreichen Detektive aus Rocky Beach; den Fluch bannen? Sie kämpfen gegen Geister und Dämonen; gegen die vier Elemente und den Feuerteufel. Ein auswegloses Unterfangen?'; 'Die drei ???; Folge 90\nDer Feuerteufel'; 'Veröffentlichungsdatum: 15.05.2000'; 'Erzähler - Matthias Fuchs\nJustus Jonas; Erster Detektiv - Oliver Rohrbeck\nPeter Shaw; Zweiter Detektiv - Jens Wawrczeck\nBob Andrews; Recherchen und Archiv - Andreas Fröhlich\nAaron Moore - Reent Reins\nRoxanne - Regine Lamster\nBruce Black - Til Demtröder']
[91; 'Labyrinth der Götter'; 'Der Regisseur Edward Truman hat seinen skandalumwitterten Film kurz vor der Premiere zurückgezogen und an einem geheimen Ort versteckt. Der Hinweis einer alten Schauspielerin führt Justus; Peter und Bob; die drei Detektive aus Rocky Beach; zu Trumans Grundstück. Doch dieses ist umgeben von einem undurchdringlichen Heckenlabyrinth. Die Kombinationsfähigkeit der drei ??? wird auf eine harte Probe gestellt. Rätselhafte Götterstatuen scheinen den Weg durch den Irrgarten zu weisen. Doch irgendjemand legt falsche Spuren; so dass die Detektive die Orientierung verlieren. Wo ist der Ausgang aus dem Labyrinth der Götter?'; 'Die drei ???; Folge 91\nLabyrinth der Götter'; 'Veröffentlichungsdatum: 14.08.2000'; 'Erzähler - Matthias Fuchs\nJustus Jonas; Erster Detektiv - Oliver Rohrbeck\nPeter Shaw; Zweiter Detektiv - Jens Wawrczeck\nBob Andrews; Recherchen und Archiv - Andreas Fröhlich\nStanley Truman - Horst Stark\nMr. Shaw - Eberhard Haar\nMrs. Jones - Gisela Trowe\nMrs. Shoemaker - Barbara Schnipper']
[92; 'Todesflug'; 'Justus; Peter und Bob sitzen fest. Mitten in der Wüste versagt ihr Auto und das Wasser geht zur Neige. Die Nerven der drei Jungs sind zum Zerreißen gespannt. Plötzlich durchbricht ein Dröhnen die Stille: Ein Tiefflieger zieht über ihre Köpfe hinweg und setzt zur Landung an. Die drei Detektive schöpfen Hoffnung. Das könnte die Rettung bedeuten. Doch unversehens geraten sie in eine tödliche Falle. Ein größenwahnsinniger Weltraumforscher bringt Bob in höchste Lebensgefahr. Wie können die drei cleveren Jungs verhindern; dass Bob ins Weltall geschossen wird?'; 'Die drei ???; Folge 92\nTodesflug'; 'Veröffentlichungsdatum: 09.10.2000'; 'Erzähler - Matthias Fuchs\nJustus Jonas; Erster Detektiv - Oliver Rohrbeck\nPeter Shaw; Zweiter Detektiv - Jens Wawrczeck\nBob Andrews; Recherchen und Archiv - Andreas Fröhlich\nGregstone - Wolf Rathjen\nButch - Frank Felicetti\nRamirez - Tobias Schmidt\nRadiosprecher - Hubertus Borck']
[93; 'und das Geisterschiff'; 'Ein Geisterschiff kreuzt vor der Küste von Rocky Beach. Justus; Peter und Bob trauen ihren Augen nicht: Der Dreimaster mit den zerfetzten Segeln gleitet durch die neblige See. Spuk oder Wirklichkeit? Die drei Jungs brauchen starke Nerven; denn Nachforschungen führen sie zu Piraten aus längst vergangenen Zeiten. Hat ein Fluch sie in die Gegenwart zurückgebracht? Um das Rätsel zu lösen; gibt es nur eine Möglichkeit: Die drei Detektive aus Rocky Beach müssen selbst an Bord gehen...'; 'Die drei ???; Folge 93\nund das Geisterschiff'; 'Veröffentlichungsdatum: 27.11.2000'; 'Erzähler - Matthias Fuchs\nJustus Jonas; Erster Detektiv - Oliver Rohrbeck\nPeter Shaw; Zweiter Detektiv - Jens Wawrczeck\nBob Andrews; Recherchen und Archiv - Andreas Fröhlich\nMr. Quin - Rasmus Borowski\nMr. Conrad Farnham - Lothar Grützner\nMrs. Mathilda Jonas - Karin Lieneweg\nOnkel Titus Jonas - Hans Meinhardt\nDeborah Snell - Anja Topf']
[94; 'Das schwarze Monster'; 'Zirkus Trinket kommt mit einer unglaublichen Attraktion nach Rocky Beach: In der Manege tritt ein mörderisches Monster aus den Wäldern Alaskas auf. Doch dann entsteigt die Kreatur dem Käfig und verbreitet Angst und Schrecken. Die drei ??? nehmen die Spur des rätselhaften Wesens auf; denn natürlich glauben sie nicht an ein echtes Monster. Doch plötzlich steht es vor ihnen ...'; 'Die drei ???; Folge 94\nDas schwarze Monster'; 'Veröffentlichungsdatum: 27.11.2000'; 'Erzähler - Matthias Fuchs\nJustus Jonas; Erster Detektiv - Oliver Rohrbeck\nPeter Shaw; Zweiter Detektiv - Jens Wawrczeck\nBob Andrews; Recherchen und Archiv - Andreas Fröhlich\nMathilda Jonas - Karin Lieneweg\nAlois Copper - Werner Cartano\nMr. Carter - Marius Berthold\nMiss Lilly - Jocelyn Boisseaux-Endemann\nInspektor Cotta - Holger Mahlich\nFrau des Bürgermeisters - Wanda Osten\nReporter - Jacky Nonnon\nStewart - Till Madaus\nPico; Clown - Hubertus Borck']
[95; 'Botschaft von Geisterhand'; 'Dr. Arroway; Archäologin und Spezialistin auf dem Gebiet der alten Maya-Indianer; erfährt durch Zufall; dass sie bestohlen werden soll: Ein geheimnisvoller Unbekannter hat es auf das heilige Buch der Maya abgesehen; das Popol Vuh. Warum ist dieses Buch so wichtig? Verbirgt sich darin eine geheime Botschaft? Wer hat Interesse daran; sie zu entschlüsseln? Die drei Detektive aus Rocky Beach nehmen sich die Falls an und versuchen das Rätsel zu lösen. Doch als das Popol Vuh gestohlen wird; drängt die Zeit - wer lüftet als Erster das Geheimnis des heiligen Buches?'; 'Die drei ???; Folge 95\nBotschaft von Geisterhand'; 'Veröffentlichungsdatum: 12.02.2001'; 'Erzähler - Matthias Fuchs\nJustus Jonas; Erster Detektiv - Oliver Rohrbeck\nPeter Shaw; Zweiter Detektiv - Jens Wawrczeck\nBob Andrews; Recherchen und Archiv - Andreas Fröhlich\nJelena Charkov - Alexandra Doerk\nMr. Charkov - Klaus Dittmann\nDr. Arroway - Sona Cervena\nJanet; ihre Assistentin - Ute Rohrbeck\nTom Gordon - Philip Hoier\nDixon - Utz Richter']
[96; 'und der rote Rächer'; 'Es brennt! Ein anonymer Anrufer meldet Jusuts ein Feuer am Hafen von Rocky Beach. Doch als er als Helfer in der Not am Brandort eintrifft; wendet sich das Blatt: Die Visitenkarte der drei ??? wird am Tatort gefunden und bringt Justus; Peter und Bob plötzlich in den Verdacht der Brandstiftung. Eine brenzliche Situation! Nur die Überführung des wahren Täters kann die drei Detektive entlasten. Doch der Spur des Brandstifters zu folgen ist ein gefährliches Unterfangen. Die drei ??? müssen scharf kombinieren und vor allem einen kühlen Kopf bewahren.'; 'Die drei ???; Folge 96\nund der rote Rächer'; 'Veröffentlichungsdatum: 09.04.2001'; 'Erzähler - Matthias Fuchs\nJustus Jonas; Erster Detektiv - Oliver Rohrbeck\nPeter Shaw; Zweiter Detektiv - Jens Wawrczeck\nBob Andrews; Recherchen und Archiv - Andreas Fröhlich\nTante Mathilda - Karin Lieneweg\nDetective Frank - Wolf Frass\nDave Rawling - Helmut Gentsch\nPraktikantin Lesley - Ann Montenbruck\nMrs. Shaw - Heikedine Körting\nMr. Smith - Douglas Welbat\nSheppard - Marius Kreissler\nFeuerwehrmann - Wolfgang Kaven']
[97; 'Insektenstachel'; 'Regungslos sitzt das Insekt auf dem Lampenschirm. Es sieht aus wie eine Riesenwespe. Der Körper ist etwa dreißig Millimeter lang und am Hinterteil blitzt der Ansatz eines Stachels auf. Das Sonnenlicht spiegelt sich in den Facettenaugen. Mrs Hazelwood schwinden die Sinne... Die alte Dame hat panische Angst vor Insekten. Als ihre Hausangestellte Opfer eines Hornissenangriffs wird; dreht sie durch. Die drei ??? leisten erste Hilfe und stoßen dabei auf einige merkwürdige Dinge...'; 'Die drei ???; Folge 97\nInsektenstachel'; 'Veröffentlichungsdatum: 11.06.2001'; 'Erzähler - Matthias Fuchs\nJustus Jonas; Erster Detektiv - Oliver Rohrbeck\nPeter Shaw; Zweiter Detektiv - Jens Wawrczeck\nBob Andrews; Recherchen und Archiv - Andreas Fröhlich\nJanet Hazelwood - Marianne Kehlau\nLaura Stryker - Regina Lemnitz\nOnkel Titus - Hans Meinhardt\nMrs. White - Brigitte Böttrich\nMr. Collins - Daniel Eggers']
[98; 'Tal des Schreckens'; 'Mitten in den Magic Mountains wacht eine Frau am Steuer ihres Autos auf: Sie hat keine Ahnung wo sie ist; ihr Kopf schmerzt. Das Einzige; an das sie sich erinnern kann; ist ein Indianer mit Adlerkopfmaske; der sie mitten in der Nacht aus dem Auto gezerrt hat. Die Polizei zweifelt an dem Verstand der Frau; doch die drei ??? glauben ihr. Todesmutig machen sie sich auf in das Tal des Schreckens und erleben die Horrornacht ihres Lebens.'; 'Die drei ???; Folge 98\nTal des Schreckens'; 'Veröffentlichungsdatum: 13.08.2001'; 'Erzähler - Matthias Fuchs\nJustus Jonas; Erster Detektiv - Oliver Rohrbeck\nPeter Shaw; Zweiter Detektiv - Jens Wawrczeck\nBob Andrews; Recherchen und Archiv - Andreas Fröhlich\nAnn Sullivan - Heidi Schaffrath\nMr. Martin - Christian Mey\nMr. Caddy - Helmut Gentsch\nKellnerin - Anna Carlsson\nLady Day - Reinhilt Schneider\nHenry - Wilhelm Wieben\nMann aus der Wüste - Wilhelm Hornbostel\nMiller - Lutz Mackensy\nDebby - Roswitha Benda\nJoe - Jakob Lichtblau [Eberhard Haar]']
[99; 'Rufmord'; 'On Air - das rote Licht im Aufnahmestudio des Radiosenders von Rocky Beach leuchtet. Die drei ??? sind live auf Sendung. Und kein anderer als der berühmte Starmoderator Kevin Anderson führt mit witzigen Sprüchen durchs Programm. Justus; Peter und Bob berichten begeistert von ihrer Detektivarbeit - bis sich plötzlich ein anonymer Anrufer in die Sendung schaltet und mit verstellter Stimme eine unheilvolle Drohung ausspricht. Ein neuer Fall für die drei Detektive?'; 'Die drei ???; Folge 99\nRufmord'; 'Veröffentlichungsdatum: 10.09.2001'; 'Erzähler - Matthias Fuchs\nJustus Jonas; Erster Detektiv - Oliver Rohrbeck\nPeter Shaw; Zweiter Detektiv - Jens Wawrczeck\nBob Andrews; Recherchen und Archiv - Andreas Fröhlich\nTante Mathilda - Karin Lieneweg\nInspektor Cotta - Holger Mahlich\nKevin Anderson - Thomas Bug\nClarissa Franklin - Judy Winter\nDr. Freeman - Jürgen Thormann\nMrs. Brighton - Monika Werner\nMrs. Wheel - Ines Sawatzki\nSchwester Whitney - Andrea Lange\nBesucher - Eckart Dux\nBote - Stefan Rütter\nGoodween - André Minninger']
[100; 'Toteninsel'; 'Die drei ??? übernehmen ihren 100sten Fall Fall! In drei spannenden Folgen sind sie dem Geheimnis der Toteninsel auf der Spur. Eine große Herausforderung für die Detektive. Weswegen sie gut beraten sind; die Hilfe alter Wegbegleiter anzunehmen; um Das Rätsel der Sphinx (Teil 1) zu lösen. Doch plötzlich ist Peter verschwunden und auch Das vergessene Volk (Teil 2) kann Justus und Bob bei ihrer Suche nicht weiterhelfen. Erst Der Fluch der Gräber (Teil 3) führt die drei ??? auf eine heiße Spur.'; 'Die drei ???; Folge 100\nToteninsel'; 'Veröffentlichungsdatum: 15.10.2001'; 'Erzähler - Matthias Fuchs\nJustus Jonas; Erster Detektiv - Oliver Rohrbeck\nPeter Shaw; Zweiter Detektiv - Jens Wawrczeck\nBob Andrews; Recherchen und Archiv - Andreas Fröhlich\nSkinny Norris - Andreas von der Meden\nMorton - Andreas von der Meden\nJelena - Alexandra Doerk\nDr. Svenson - Antje Roosch\nMr. Schwarz - Erik Schäffler\nMr. Olin - Uli Krohm\nJuan - Oliver Böttcher\nProfessor Phoenix - Wilfried Glatzeder\nRachel Hadden - Anna Carlsson\nAl - Nico König\nAnne - Corinna Wodrich']
[101; 'und das Hexenhandy'; 'Der neuste Hit unter Teenagern in Rocky Beach:"Hexen-Handys"! Sie leuchten im Dunkeln giftgrün und statt zu klingeln; kichern sie gruselig. Doch dann legt sich ein düsterer Schatten auf das Küstenstädchen. Einige der stolzen Besitzer dieser Handys verschwinden auf unheimliche Weise. Zurück am Tatort bleiben nur die leuchtenden Mobiltelefone; auf deren Display die Teufelszahl 666 erscheint. Die drei Detektive Justus; Peter und Bob nehmen per Handy die Spur auf; ohne zu wissen; was sie am anderen Ende der Leitung erwartet...'; 'Die drei ???; Folge 101\nund das Hexen-Handy'; 'Veröffentlichungsdatum: 03.12.2001'; 'Erzähler - Matthias Fuchs\nJustus Jonas; Erster Detektiv - Oliver Rohrbeck\nPeter Shaw; Zweiter Detektiv - Jens Wawrczeck\nBob Andrews; Recherchen und Archiv - Andreas Fröhlich\nGiorgio Cade - Bastian Pastewka\nMonique Carrera - Amanda Lear\nMrs. Jones - Marianne Kehlau\nJenny Collins - Anja Topf\nJeremy Scott - Woody Mues\nMrs. Scott - Hansi Jochmann\nOma Scott - Apollonia Minniger\nAcer - Thomas Schüler']
[102; 'Doppelte Täuschung'; 'Bob gerät mitten in einen Banküberfall und kann für Bruchteile von Sekunden das Gesicht des Täters sehen. Während die drei ??? das erstellte Phantombild genau studieren; stattet der Bankräuber ihnen einen Besuch in der Zentrale ab. Zunächst scheint geklärt; dass es sich bei ihrem neuen Auftraggeber um den Zwillingsbruder des Verdächtigen handelt. Doch schon bald wissen Justus; Peter und Bob nicht mehr; mit welchem der Brüder sie es zu tun haben. Ein gefährliches Verwirrspiel beginnt.'; 'Die drei ???; Folge 102\nDoppelte Täuschung'; 'Veröffentlichungsdatum: 11.03.2002'; 'Erzähler - Matthias Fuchs\nJustus Jonas; Erster Detektiv - Oliver Rohrbeck\nPeter Shaw; Zweiter Detektiv - Jens Wawrczeck\nBob Andrews; Recherchen und Archiv - Andreas Fröhlich\nInspektor Cotta - Holger Mahlich\nKing - Wolfgang Condrus\nJenny Collins - Anja Topf\nTricia Wilson - Ursula Vogel\nGoodween - André Minninger']
[103; 'Das Erbe des Meisterdiebs'; 'Der berühmte Meisterdieb Victor Hugenay ist tot! In einem rätselhaften Testament hinterlässt er Hinweise auf bisher unentdecktes Diebesgut: einige wertvolle Gemälde. Eine Herausforderung für Justus` Superhirn! Aber der Erste Detektiv lässt sich diesmal von seiner Arbeit ablenken. Was ist los mit dem Kopf der drei Detektive? Als ein geheimnisvoller Unbekannter ebenfalls hinter dem Bilderversteck her zu sein scheint; müssen Justus; Peter und Bob zeigen; was in ihnen steckt.'; 'Die drei ???; Folge 103\nDas Erbe des Meisterdiebes'; 'Veröffentlichungsdatum: 13.05.2002'; 'Erzähler - Matthias Fuchs\nJustus Jonas; Erster Detektiv - Oliver Rohrbeck\nPeter Shaw; Zweiter Detektiv - Jens Wawrczeck\nBob Andrews; Recherchen und Archiv - Andreas Fröhlich\nBrittany - Dorette Hugo\nVictor Hugenay - Albert Giro [Wolfgang Kubach]\nTante Mathilda - Karin Lieneweg\nWilbur Graham - Thomas Bammer\nBruder Raphael - Siegfried Kernen\nInspektor Berger - Jan Buchwald\nBaldwin - Gerhart Hinze']
[104; 'Gift per E-Mail'; 'Achtung Feuerquallen!- Beim Tauchen vor der Küste von Rocky Beach kann Mrs Baker den giftigen Tieren in letzter Sekunde entkommen. Aber dann erscheinen die Quallen plötzlich per E-Mail auf Mrs Bakers Computerbildschirm und bedrohen nicht nur ihre Dateien; sondern auch ihr Leben. Mit Hilfe von Tom Wood - einem Computerspezialisten - nehmen die drei ??? die Spur des anonymen Absenders auf. Wenn da nur nicht Dick Perry wäre; ein überheblicher Detektiv aus Santa Monica; der Justus; Peter und Bob die Ermittlung mehr als schwer macht ...'; 'Die drei ???; Folge 104\nGift per E-Mail'; 'Veröffentlichungsdatum: 08.07.2002'; 'Erzähler - Thomas Fritsch\nJustus Jonas; Erster Detektiv - Oliver Rohrbeck\nPeter Shaw; Zweiter Detektiv - Jens Wawrczeck\nBob Andrews; Recherchen und Archiv - Andreas Fröhlich\nDick Perry - Ernst Hilbich\nMrs. Meg Baker - Lotti Krekel\nMrs. Wood - Elga Schütz\nJack Sharky - Stefan Babic\nBetty Shutton - Regina Pressler\nInspektor Cotta - Holger Mahlich\nMrs. Tante Mathilda Jonas - Karin Lieneweg']
[105; 'und der Nebelberg'; 'Eine Wandertour in den Rocky Mountains - Peter und Bob sind begeistert! Doch unterwegs hüllt auf einmal ein undurchdringlicher Nebel den Berggipfel ein und die Wandergruppe wird von einer geisterhaften Erscheinung überrascht. "Das Phantom ist zurückgekehrt"; murmeln die Alten des nahe gelegenen Bergdorfes. Da fängt der Erste Detektiv Feuer; denn neben der körperlichen Anstrengung sind jetzt seine Gehirnzellen gefragt. Was steckt hinter der Spukerscheinung? Die drei ??? müssen diesmal besonders klug vorgehen; um die wortkargen Einsiedler zum Sprechen zu bringen.'; 'Die drei ???; Folge 105\nDer Nebelberg'; 'Veröffentlichungsdatum: 16.09.2002'; 'Erzähler - Thomas Fritsch\nJustus Jonas; Erster Detektiv - Oliver Rohrbeck\nPeter Shaw; Zweiter Detektiv - Jens Wawrczeck\nBob Andrews; Recherchen und Archiv - Andreas Fröhlich\nJoanna Masterson - Barbara Marcks\nJack Masterson - Wolfgang Draeger\nSarah Masterson - Nadja Reichardt\nMr Harry Falkner - Wolfgang Hartmann\nHarvey Ashford - Rolf E. Schenker\nMarc - Hartmut Kollakowski']
[106; 'Der Mann ohne Kopf'; '`DJ-Devil´; von der Presse auch reißerisch `Satans-DJ´ genannt; scheint wahrlich über teuflische Fähigkeiten zu verfügen. Der geheimnisvolle Discjockey ohne Kopf entlockt am Wochenende seinem Mischpult die unheimlichsten Beats; die die tanzenden Besucher in rasende Euphorie versetzen. Doch plötzlich gerät die Szenerie außer Kontrolle. Die drei ??? sind an diesem Abend zufällige Besucher in der Diskothek `Planet-Evil´ und werden Zeugen eines unheimlichen Phänomens; das Justus an die Grenzen seiner Logik katapultiert ...'; 'Die drei ???; Folge 106\nDer Mann ohne Kopf'; 'Veröffentlichungsdatum: 16.09.2002'; 'Erzähler - Thomas Fritsch\nJustus Jonas; Erster Detektiv - Oliver Rohrbeck\nPeter Shaw; Zweiter Detektiv - Jens Wawrczeck\nBob Andrews; Recherchen und Archiv - Andreas Fröhlich\nAmy Scream - Marianne Kehlau\nMonique Carrera - Amanda Lear\nInspektor Cotta - Holger Mahlich\nEllen - Celine Fontanges\nPam - Enie van de Meiklokjes\nJim Cowley - Cäsar\nJeffrey - Kim Alexander Frank\nMandy Robin - Manuela Dahm\n1. Sanitäter - Robert Missler\n2. Sanitäter - Hartmut Kollakowsky\nBardame - Monique Carrera [Amanda Lear]\nTante Mathilda - Karin Lieneweg\nDiskothekenbesucher - Echt']
[107; 'und der Schatz der Mönche'; '"Ich möchte Peter Shaw sprechen. Es ist dringend." - "Worum geht es denn; Mister?"- "Um sein Leben." Eigentlich hatte Peter nur nach einem geeigneten Drehort für ein Filmprojekt an der Schule gesucht. Doch in der verlassenen Fabrikhalle findet er mehr als nur einen stimmungsvollen Schauplatz für den geplanten Kriminalfilm: ein geheimnisvolles Kästchen; einen Zettel mit merkwürdigen Schriftzeichen - und einen messerwerfenden Asiaten; der sich sofort an seine Fersen heftet. Und das ist erst der Auftakt zu einem neuen Fall für die drei ???'; 'Die drei ???; Folge 107\nund der Schatz der Mönche'; 'Veröffentlichungsdatum: 13.01.2003'; 'Erzähler - Thomas Fritsch\nJustus Jonas; Erster Detektiv - Oliver Rohrbeck\nPeter Shaw; Zweiter Detektiv - Jens Wawrczeck\nBob Andrews; Recherchen und Archiv - Andreas Fröhlich\nMorton - Andreas von der Meden\nLama Geshe - Rolf Nagel\nTai Sutsi - Dr. Boo Young-Shin\nChuck - Yan Kimsang\nVinaya - Prof. Dr. Zhu\nMr Zhang - Ingo Feder\nLesley Dimple - Maja Stehli [Ingeborg Kantstein ?]\nMrs. Wilbur - Ingeburg Kanstein']
[108; 'Die sieben Tore'; 'Wer ist der unheimliche Mr Carter; der in einem düsteren Schloss lebt und aussieht wie ein abgemagerter Vogel? Auch sein Auftrag für die drei ??? ist mehr als seltsam: "Findet das Versteck bei den sieben Toren". Was zunächst harmlos klingt; entpuppt sich als äußerst gefährliches Unterfangen. Justus; Peter und Bob müssen Räume betreten; deren Türen sie besser nicht geöffnet hätten; und entdecken dabei Unglaubliches...'; 'Die drei ???; Folge 108\nDie sieben Tore'; 'Veröffentlichungsdatum: 07.04.2003'; 'Erzähler - Thomas Fritsch\nJustus Jonas; Erster Detektiv - Oliver Rohrbeck\nPeter Shaw; Zweiter Detektiv - Jens Wawrczeck\nBob Andrews; Recherchen und Archiv - Andreas Fröhlich\nCaspar Carter - Claus Wilcke\nEnid - Janina Richter\nAlbert - Wolf Rathjen\nMontgomery - Hans Sievers']
